product_title,product_link,company_name,company_link,is_verified_exporter,city_region,city,address_details,phone_number,phone_number_extension
Purple Baby Plastic Hairbrush,https://www.indiamart.com/proddetail/purple-baby-plastic-hairbrush-26462435833.html?pos=75&kwd=baby brush and swab&tags=||||8915.672||product|||NA|rsf:gd-|-stype:attr=1|qr_nm:gd|res:RC3|com-cf:nl|ptrs:na|ktp:N0|mc:189958|mtp:S|qry_typ:P|lang:en|wc:4|cs:8905|v=4,The Little Lookers,https://www.indiamart.com/thelittlelookers-moradabad/?pos=75&kwd=baby brush and swab&tags=||||8915.672||product|||NA|rsf:gd-|-stype:attr=1|qr_nm:gd|res:RC3|com-cf:nl|ptrs:na|ktp:N0|mc:189958|mtp:S|qry_typ:P|lang:en|wc:4|cs:8905|v=4,False,,Moradabad,"4-B-145, Buddhi Vihar Yozna Mbd, Moradabad - 244001, Dist.Moradabad, Uttar Pradesh",8047655658,
Baby Silicon Brush,,Midas Marketing,https://www.indiamart.com/midas-marketing/?pos=76&kwd=baby brush and swab&tags=||||8228.275||product|||NA|rsf:gd-|-stype:attr=1|qr_nm:gd|res:RC3|com-cf:nl|ptrs:na|ktp:N0|mc:189958|mtp:S|qry_typ:P|lang:en|wc:4|cs:8905|v=4,False,,Ahmedabad,"B 61, C .P. Nagar, Part 2, Sola Road, Ghatlodia, Ahmedabad - 380061, Dist.Ahmedabad, Gujarat",8048372652,933
Kids Care Brush,https://www.indiamart.com/proddetail/kids-care-brush-2528349291.html?pos=77&kwd=baby brush and swab&tags=||||8270.32||product|||NA|rsf:gd-|-stype:attr=1|qr_nm:gd|res:RC3|com-cf:nl|ptrs:na|ktp:N0|mc:189958|mtp:S|qry_typ:P|lang:en|wc:4|cs:8905|v=4,Belgium Glass Andceramics Pvt. Ltd.,https://www.indiamart.com/belgium-glass-ceramics/?pos=77&kwd=baby brush and swab&tags=||||8270.32||product|||NA|rsf:gd-|-stype:attr=1|qr_nm:gd|res:RC3|com-cf:nl|ptrs:na|ktp:N0|mc:189958|mtp:S|qry_typ:P|lang:en|wc:4|cs:8905|v=4,False,Village Dabhasha,Padra,"Green Ford Side, Baroda- Jambuusar National Highway Road, Taluka , Village Dabhasha, Village Dabhasha, Padra - 391440, Dist.Vadodara, Gujarat",8047698271,
Pink Baby Hair Brushes Cleaning Set,https://www.indiamart.com/proddetail/pink-baby-hair-brushes-cleaning-set-2852418792812.html?pos=78&kwd=baby brush and swab&tags=||||8211.142|Price|product|||NA|rsf:gd-|-stype:attr=1|qr_nm:gd|res:RC3|com-cf:nl|ptrs:na|ktp:N0|mc:189958|mtp:S|qry_typ:P|lang:en|wc:4|cs:8905|v=4,Baby World,https://www.indiamart.com/babyworlds/?pos=78&kwd=baby brush and swab&tags=||||8211.142|Price|product|||NA|rsf:gd-|-stype:attr=1|qr_nm:gd|res:RC3|com-cf:nl|ptrs:na|ktp:N0|mc:189958|mtp:S|qry_typ:P|lang:en|wc:4|cs:8905|v=4,False,,Mumbai,"Groung Floor, Shop No 4-A, 37, Hawa Mansion, Shaikh Memon Street, Pinjara Street, Mandvi, Mumbai - 400003, Dist.Mumbai, Maharashtra",8048981354,
Scarlet Line Professional Small Wooden Flat Baby Hair Brush with Back Side Mirror for Children,https://www.indiamart.com/proddetail/scarlet-line-professional-small-wooden-flat-baby-hair-brush-with-back-side-mirror-for-children-22250819848.html?pos=79&kwd=baby brush and swab&tags=||||8228.275|Price|product|||NA|rsf:gd-|-stype:attr=1|qr_nm:gd|res:RC3|com-cf:nl|ptrs:na|ktp:N0|mc:189958|mtp:S|qry_typ:P|lang:en|wc:4|cs:8905|v=4,Instyle,https://www.indiamart.com/instyle-ahmedabad/?pos=79&kwd=baby brush and swab&tags=||||8228.275|Price|product|||NA|rsf:gd-|-stype:attr=1|qr_nm:gd|res:RC3|com-cf:nl|ptrs:na|ktp:N0|mc:189958|mtp:S|qry_typ:P|lang:en|wc:4|cs:8905|v=4,False,Relief Road,Ahmedabad,"2787/1, Nisha Pole Naka, Zaveriwad Gate, Relief Road, Ahmedabad - 380001, Dist.Ahmedabad, Gujarat",8047668753,
Baby Silicon Finger Toothbrush,https://www.indiamart.com/proddetail/baby-silicon-finger-toothbrush-2854975697673.html?pos=80&kwd=baby brush and swab&tags=||||8752.144|Price|product|||NA|rsf:gd-|-stype:attr=1|qr_nm:gd|res:RC3|com-cf:nl|ptrs:na|ktp:N0|mc:189958|mtp:S|qry_typ:P|lang:en|wc:4|cs:8905|v=4,Virenika Industries,https://www.indiamart.com/virenika-industries/?pos=80&kwd=baby brush and swab&tags=||||8752.144|Price|product|||NA|rsf:gd-|-stype:attr=1|qr_nm:gd|res:RC3|com-cf:nl|ptrs:na|ktp:N0|mc:189958|mtp:S|qry_typ:P|lang:en|wc:4|cs:8905|v=4,False,,New Delhi,"A-61, indirapark , masudabad , najafgarh najafgarh, New Delhi - 110053, Dist.Delhi, Delhi",8047662058,
"12572 Cartoon Hair Brush Massage Shower Comb Blur Wet Salon Hair Brushes Hair Styling Tools, Glitter Comb, Soft & Smooth Brush, Mermaid Brush For Kids Return Gifts For Kids (1 Pc )",https://www.indiamart.com/proddetail/12572-cartoon-hair-brush-massage-shower-comb-blur-wet-salon-hair-brushes-hair-styling-tools-glitter-comb-soft-smooth-brush-mermaid-brush-for-kids-return-gifts-for-kids-1-pc-2854348518955.html?pos=81&kwd=baby brush and swab&tags=||||8706.587|Price|product|||NA|rsf:gd-|-stype:attr=1|qr_nm:gd|res:RC3|com-cf:nl|ptrs:na|ktp:N0|mc:189958|mtp:S|qry_typ:P|lang:en|wc:4|cs:8905|v=4,offersonlineshop.in,https://www.indiamart.com/offersonlineshopin/?pos=81&kwd=baby brush and swab&tags=||||8706.587|Price|product|||NA|rsf:gd-|-stype:attr=1|qr_nm:gd|res:RC3|com-cf:nl|ptrs:na|ktp:N0|mc:189958|mtp:S|qry_typ:P|lang:en|wc:4|cs:8905|v=4,False,,Madurai,"Pin code :- 625514 City :- madurai State :- tamilnadu madurai 625514 Tamil Nadu, Madurai - 625514, Dist.Madurai, Tamil Nadu",,
"Toothbrush - Soft Bristle Toothbrush - 3-sided Training Toothbrush With Silicone Head, Inverted Cleaning Toothbrush For Aged 2-12, Children's Cleaning (1 Pc)",https://www.indiamart.com/proddetail/toothbrush-soft-bristle-toothbrush-3-sided-training-toothbrush-with-silicone-head-inverted-cleaning-toothbrush-for-aged-2-12-children-s-cleaning-1-pc-2855060751855.html?pos=82&kwd=baby brush and swab&tags=||||9289.285|Price|product|||FCPE|rsf:gd-|-stype:attr=1|qr_nm:gd|res:RC3|com-cf:nl|ptrs:na|ktp:N0|mc:189958|mtp:S|qry_typ:P|lang:en|wc:4|cs:8905|v=4,darling lifestyle,https://www.indiamart.com/darling-lifestyle/?pos=82&kwd=baby brush and swab&tags=||||9289.285|Price|product|||FCPE|rsf:gd-|-stype:attr=1|qr_nm:gd|res:RC3|com-cf:nl|ptrs:na|ktp:N0|mc:189958|mtp:S|qry_typ:P|lang:en|wc:4|cs:8905|v=4,False,,Visakhapatnam,"karri banu s/o k abbainaidu ration depo 3 karri street s rayavaram po vill md visakhapatnam distc andhrapradesh, Visakhapatnam - 531060, Dist.Visakhapatnam, Andhra Pradesh",,
"6892 Electric Toothbrush With Light & Music, Kids U-shaped 360 Usb Rechargeable Plastic Automatic Toothbrush Portable Adjustable Cleaning Whitening Toothbrush With Usb Charging Function Plastic + Abs For Kids",https://www.indiamart.com/proddetail/6892-electric-toothbrush-with-light-music-kids-u-shaped-360-usb-rechargeable-plastic-automatic-toothbrush-portable-adjustable-cleaning-whitening-toothbrush-with-usb-charging-function-plastic-abs-for-kids-2854513625748.html?pos=83&kwd=baby brush and swab&tags=||||8741.812|Price|product|||NA|rsf:gd-|-stype:attr=1|qr_nm:gd|res:RC3|com-cf:nl|ptrs:na|ktp:N0|mc:189958|mtp:S|qry_typ:P|lang:en|wc:4|cs:8905|v=4,Go5 Incorporation,https://www.indiamart.com/go5incorporation/?pos=83&kwd=baby brush and swab&tags=||||8741.812|Price|product|||NA|rsf:gd-|-stype:attr=1|qr_nm:gd|res:RC3|com-cf:nl|ptrs:na|ktp:N0|mc:189958|mtp:S|qry_typ:P|lang:en|wc:4|cs:8905|v=4,False,,Gurugram,"T 2/13, DLF Phase 3, Gurugram - 122002, Dist.Gurgaon, Haryana",,
Baby Hair Brush,https://www.indiamart.com/proddetail/baby-hair-brush-21240032133.html?pos=84&kwd=baby brush and swab&tags=||||8211.142|Price|product|||NA|rsf:gd-|-stype:attr=1|qr_nm:gd|res:RC3|com-cf:nl|ptrs:na|ktp:N0|mc:189958|mtp:S|qry_typ:P|lang:en|wc:4|cs:8905|v=4,Sai Kiran Enterprises,https://www.indiamart.com/sai-kiran-entps/?pos=84&kwd=baby brush and swab&tags=||||8211.142|Price|product|||NA|rsf:gd-|-stype:attr=1|qr_nm:gd|res:RC3|com-cf:nl|ptrs:na|ktp:N0|mc:189958|mtp:S|qry_typ:P|lang:en|wc:4|cs:8905|v=4,False,,Mumbai,"Gala No. 6, Pooja Garage, Goregaon East, Mumbai - 400063, Dist.Mumbai, Maharashtra",8043878455,
Black Plastic Zodiac Hair Dey Brush Comb,https://www.indiamart.com/proddetail/zodiac-hair-dey-brush-comb-2851581552162.html?pos=85&kwd=baby brush and swab&tags=||||8559.269|Price|product|||NA|rsf:gd-|-stype:attr=1|qr_nm:gd|res:RC3|com-cf:nl|ptrs:na|ktp:N0|mc:189958|mtp:S|qry_typ:P|lang:en|wc:4|cs:8905|v=4,New Satish General Store,https://www.indiamart.com/newsatish-generalstore/?pos=85&kwd=baby brush and swab&tags=||||8559.269|Price|product|||NA|rsf:gd-|-stype:attr=1|qr_nm:gd|res:RC3|com-cf:nl|ptrs:na|ktp:N0|mc:189958|mtp:S|qry_typ:P|lang:en|wc:4|cs:8905|v=4,False,Ram Bagh,Indore,"15,3, Jawahar Marg, Ram Bagh, Indore - 452007, Dist.Indore, Madhya Pradesh",8048979581,
"12572 Cartoon Hair Brush Massage Shower Comb Blur Wet Salon Hair Brushes Hair Styling Tools, Glitter Comb, Soft & Smooth Brush, Mermaid Brush For Kids Return Gifts For Kids (1 Pc )",https://www.indiamart.com/proddetail/12572-cartoon-hair-brush-massage-shower-comb-blur-wet-salon-hair-brushes-hair-styling-tools-glitter-comb-soft-smooth-brush-mermaid-brush-for-kids-return-gifts-for-kids-1-pc-2854457439688.html?pos=86&kwd=baby brush and swab&tags=||||8786.56|Price|product|||FCPE|rsf:gd-|-stype:attr=1|qr_nm:gd|res:RC3|com-cf:nl|ptrs:na|ktp:N0|mc:189958|mtp:S|qry_typ:P|lang:en|wc:4|cs:8905|v=4,Jaatara,https://www.indiamart.com/company/225931792/?pos=86&kwd=baby brush and swab&tags=||||8786.56|Price|product|||FCPE|rsf:gd-|-stype:attr=1|qr_nm:gd|res:RC3|com-cf:nl|ptrs:na|ktp:N0|mc:189958|mtp:S|qry_typ:P|lang:en|wc:4|cs:8905|v=4,False,,Cyberabad,"8-4-376/22, New Shastri Nagar Erragadda, Hyderabad - 500018 Telangana, Cyberabad - 500018, Dist.Hyderabad, Andhra Pradesh",,
"Baby Hair Brush Comb, Newly Born",,Royal Enterprises,https://www.indiamart.com/royalenterprises-95911176/?pos=87&kwd=baby brush and swab&tags=||||8752.144|Price|product|||NA|rsf:gd-|-stype:attr=1|qr_nm:gd|res:RC3|com-cf:nl|ptrs:na|ktp:N0|mc:189958|mtp:S|qry_typ:P|lang:en|wc:4|cs:8905|v=4,False,,New Delhi,"Qutab Road,Delhi Sadar Bazar,110006,Delhi, New Delhi - 110031, Dist.Delhi, Delhi",8047664321,
Aflipshop Baby Grooming Baby Healthcare Kit Newborn Baby Care Accessories Baby Health Care Set Baby Nail Clipper Scissors Hair Comb Brush Nose Cleaner Safety For Toddler Infant Nursing Grooming(pack Of 6 Pc),https://www.indiamart.com/proddetail/aflipshop-baby-grooming-baby-healthcare-kit-newborn-baby-care-accessories-baby-health-care-set-baby-nail-clipper-scissors-hair-comb-brush-nose-cleaner-safety-for-toddler-infant-nursing-grooming-pack-of-6-pc-2853801480791.html?pos=88&kwd=baby brush and swab&tags=||||8752.144|Price|product|||NA|rsf:gd-|-stype:attr=1|qr_nm:gd|res:RC3|com-cf:nl|ptrs:na|ktp:N0|mc:189958|mtp:S|qry_typ:P|lang:en|wc:4|cs:8905|v=4,Aflipshop,https://www.indiamart.com/aflipshopin/?pos=88&kwd=baby brush and swab&tags=||||8752.144|Price|product|||NA|rsf:gd-|-stype:attr=1|qr_nm:gd|res:RC3|com-cf:nl|ptrs:na|ktp:N0|mc:189958|mtp:S|qry_typ:P|lang:en|wc:4|cs:8905|v=4,False,,New Delhi,"P-9, C/o Innovative E Business Service Llp Mayur Vihar Phase 1 Jp Complex New Delhi, New Delhi - 110091, Dist.Delhi, Delhi",,
Wooden Comb & Mirror Hair Brush Set For All Hair Types (Pack of 2),,Neelam E-Retail,https://www.indiamart.com/neelam-enterprises-kanpur/?pos=89&kwd=baby brush and swab&tags=||||9045.955|Price|product|||FCPE|rsf:gd-|-stype:attr=1|qr_nm:gd|res:RC3|com-cf:nl|ptrs:na|ktp:N0|mc:189958|mtp:S|qry_typ:P|lang:en|wc:4|cs:8905|v=4,False,General Ganj,Kanpur,"Shop No. 33/161, Radha Krishan Market, Gaya Prasad Lane, General Ganj, Kanpur - 208001, Uttar Pradesh",8048267956,
Baby Grooming Products,,Baby Hugs,https://www.indiamart.com/baby-hugs-visakhapatnam/?pos=90&kwd=baby brush and swab&tags=CC||||9289.285||product|||NA|rsf:gd-|-stype:attr=1|qr_nm:gd|res:RC3|com-cf:nl|ptrs:na|ktp:N0|mc:189958|mtp:S|qry_typ:P|lang:en|wc:4|cs:8905|v=4,False,Dondaparthy,Visakhapatnam,"# 46-22-33/1,, Dondaparthy, Visakhapatnam - 530016, Dist.Visakhapatnam, Andhra Pradesh",8062245136,227
Baby Dress Kit,,M S C Collections,https://www.indiamart.com/msc-collection-bengaluru/?pos=91&kwd=baby brush and swab&tags=CC||||8663.873||product|||NA|rsf:gd-|-stype:attr=1|qr_nm:gd|res:RC3|com-cf:nl|ptrs:na|ktp:N0|mc:189958|mtp:S|qry_typ:P|lang:en|wc:4|cs:8905|v=4,False,Rajaji Nagar,Bengaluru,"No. 245, 2nd Cross, 2nd Main Road, Ramachandrapuram, Rajaji Nagar, Bengaluru - 560021, Dist.Bengaluru, Karnataka",8048371785,499
Baby Grooming Kit,,Me N Moms Pvt. Ltd.,https://www.indiamart.com/me-n-moms-pvt-ltd-bengaluru/?pos=92&kwd=baby brush and swab&tags=CC||||8663.873||product|||NA|rsf:gd-|-stype:attr=1|qr_nm:gd|res:RC3|com-cf:nl|ptrs:na|ktp:N0|mc:189958|mtp:S|qry_typ:P|lang:en|wc:4|cs:8905|v=4,False,IT Tamadu Extension,Bengaluru,"3, Pobbathi Balakrishna Tower, 100feet Ring Road, 5th Block Banashankari 3rd Stage, Ward No. 55, IT Tamadu Extension, Bengaluru - 560085, Dist.Bengaluru, Karnataka",8069051307,824
Baby Grooming,,Mum's Care,https://www.indiamart.com/mumscaresecunderabad/?pos=93&kwd=baby brush and swab&tags=CC||||8788.159||product|||NA|rsf:gd-|-stype:attr=1|qr_nm:gd|res:RC3|com-cf:nl|ptrs:na|ktp:N0|mc:189958|mtp:S|qry_typ:P|lang:en|wc:4|cs:8905|v=4,False,M.G. Road,Secunderabad,"HM Ishaq Estate- Shop No. 22/23/24, General Bazar, M.G. Road, Secunderabad - 500003, Dist.Hyderabad, Telangana",8048247125,7274
Baby Cotton Buds,,Bablo Bebli Jiyana Shop,https://www.indiamart.com/bablo-and-bebli-jiyana-house/?pos=94&kwd=baby brush and swab&tags=||||8230.883||product|||NA|rsf:gd-|-stype:attr=1|qr_nm:gd|res:RC3|com-cf:nl|ptrs:na|ktp:N0|mc:189958|mtp:S|qry_typ:P|lang:en|wc:4|cs:8905|v=4,False,,Surat,"Shop No.4 Opp.mahalaxmi Society,kargil Chowk Road Royal Heaven Punagam, Surat - 395010, Dist.Surat, Gujarat",8048372949,424
Himalaya Baby Care Products,,Mom & Kidz,https://www.indiamart.com/momkidz-chennai/?pos=95&kwd=baby brush and swab&tags=||||8954.051||product|||NA|rsf:gd-|-stype:attr=1|qr_nm:gd|res:RC3|com-cf:nl|ptrs:na|ktp:N0|mc:189958|mtp:S|qry_typ:P|lang:en|wc:4|cs:8905|v=4,False,Triplicane,Chennai,"DOOR NO. 127/252 TRIPLICANE HIGH ROAD, TRIPLICANE,, Triplicane, Chennai - 600005, Dist.Chennai, Tamil Nadu",8048371797,605
Baby Cotton Buds,,Lil' Hub Baby Store,https://www.indiamart.com/mandotimpex/?pos=96&kwd=baby brush and swab&tags=||||8786.56||product|||NA|rsf:gd-|-stype:attr=1|qr_nm:gd|res:RC3|com-cf:nl|ptrs:na|ktp:N0|mc:189958|mtp:S|qry_typ:P|lang:en|wc:4|cs:8905|v=4,False,Begum Bazar,Hyderabad,"3-5-874/A/4, Mazzanine Floor,,Hyderguda,Hyderabad 3 FLOOR,5/1/911/3 FLAT NO 305,NAVODAYA PLAZA,,500095,Hyderabad, Begum Bazar, Hyderabad - 500029, Dist.Hyderabad, Telangana",8062245026,882
Baby Cotton Buds,,Shree Vitthal Enterprises,https://www.indiamart.com/shree-vitthal-enterprises-kanpur/?pos=97&kwd=baby brush and swab&tags=||||9045.955||product|||NA|rsf:gd-|-stype:attr=1|qr_nm:gd|res:RC3|com-cf:nl|ptrs:na|ktp:N0|mc:189958|mtp:S|qry_typ:P|lang:en|wc:4|cs:8905|v=4,False,,Kanpur,"12/36/108,,Gwaltoli Road,Kanpur 12/36/108, Gwaltoli Road, Raja Electricals, Gwaltoli, Kanpur, Kanpur Nagar, Uttar Pradesh, 208001,2, Kanpur - 208001, Uttar Pradesh",8047311015,2534
Johnsons Cotton Buds,,Hamara Mart Multitrade LLP,https://www.indiamart.com/hamara-mart-multitrade/?pos=98&kwd=baby brush and swab&tags=||||8810.737|Price|product|||NA|rsf:gd-|-stype:attr=1|qr_nm:gd|res:RC3|com-cf:nl|ptrs:na|ktp:N0|mc:189958|mtp:S|qry_typ:P|lang:en|wc:4|cs:8905|v=4,False,Dwarka Puri Colony,Saharanpur,"No.25-30, Delhi Road, Near Roop Vihar Dwarka Puri Colony, Dwarka Puri Colony, Saharanpur - 247001, Dist.Saharanpur, Uttar Pradesh",7942640836,
Johnson Cotton Bud,,Shri Govindam Pharmacy,https://www.indiamart.com/shri-govindam-pharmacy-jaipur/?pos=99&kwd=baby brush and swab&tags=||||8601.347||product|||NA|rsf:gd-|-stype:attr=1|qr_nm:gd|res:RC3|com-cf:nl|ptrs:na|ktp:N0|mc:189958|mtp:S|qry_typ:P|lang:en|wc:4|cs:8905|v=4,False,Mansarovar,Jaipur,"Shop No -75/5, Shipra Path, Mansrowar, Mansarovar, Jaipur - 302020, Dist.Jaipur, Rajasthan",8048371790,977
Mee Mee Toothbrush,,Thanvi Associates,https://www.indiamart.com/thanvi-associates/?pos=100&kwd=baby brush and swab&tags=||||8788.159|Price|product|||NA|rsf:gd-|-stype:attr=1|qr_nm:gd|res:RC3|com-cf:nl|ptrs:na|ktp:N0|mc:189958|mtp:S|qry_typ:P|lang:en|wc:4|cs:8905|v=4,False,Shivaji Nagar,Secunderabad,"Shivaji Nagar, 7-1-136, Bandimet, Maruthi Veedhi, Shivaji Nagar, Secunderabad - 500003, Dist.Hyderabad, Telangana",8047852297,
Liquid Red Baby Care Products,,Mother'S Choice Distributors,https://www.indiamart.com/avn-enterprises-yavatmal/?pos=101&kwd=baby brush and swab&tags=||||8770.455||product|||NA|rsf:gd-|-stype:attr=1|qr_nm:gd|res:RC3|com-cf:nl|ptrs:na|ktp:N0|mc:189958|mtp:S|qry_typ:P|lang:en|wc:4|cs:8905|v=4,False,Rohile Baba Galli,Yavatmal,"Plot No 7 Pimpalgaon Road, Rohile Baba Galli, Yavatmal - 445001, Dist.Yavatmal, Maharashtra",8048249734,5660
Baby Hair Brush,,Shakshi Baby,https://www.indiamart.com/shakshibaby-mumbai/?pos=102&kwd=baby brush and swab&tags=||||8211.142||product|||NA|rsf:gd-|-stype:attr=1|qr_nm:gd|res:RC3|com-cf:nl|ptrs:na|ktp:N0|mc:189958|mtp:S|qry_typ:P|lang:en|wc:4|cs:8905|v=4,False,Kandivali East,Mumbai,"Shop No. 19, E-2, Highway Park, Thakur Complex, Kandivali East, Mumbai - 400101, Dist.Mumbai, Maharashtra",8062245081,904
"baby nail cutter, baby combo, baby brush",,Nashal Consumer Products Private Limited,https://www.indiamart.com/nashal-consumer-products-private-limited/?pos=103&kwd=baby brush and swab&tags=||||8704.343|Price|product|||NA|rsf:gd-|-stype:attr=1|qr_nm:gd|res:RC3|com-cf:nl|ptrs:na|ktp:N0|mc:189958|mtp:S|qry_typ:P|lang:en|wc:4|cs:8905|v=4,False,,Patiala,"C-59,Focal Point,Patiala,Patiala, Patiala - 147001, Dist.Patiala, Punjab",8047311014,2089
Baby Hair Brushes Comb,,Ranuja Novelties,https://www.indiamart.com/ranuja-novelties/?pos=104&kwd=baby brush and swab&tags=||||8954.051||product|||NA|rsf:gd-|-stype:attr=1|qr_nm:gd|res:RC3|com-cf:nl|ptrs:na|ktp:N0|mc:189958|mtp:S|qry_typ:P|lang:en|wc:4|cs:8905|v=4,False,George Town,Chennai,"Navarathna Complex, Kasi Chetty Lane, George Town, Chennai - 600079, Dist.Chennai, Tamil Nadu",8048371801,254
Baby Hair brush,,Anandi Sales Corporation\'s,https://www.indiamart.com/anandi-sales-corporation/?pos=105&kwd=baby brush and swab&tags=||||8601.347||product|||NA|rsf:gd-|-stype:attr=1|qr_nm:gd|res:RC3|com-cf:nl|ptrs:na|ktp:N0|mc:189958|mtp:S|qry_typ:P|lang:en|wc:4|cs:8905|v=4,False,Mansarovar,Jaipur,"House No. 80/222, Patel Marg, Madhyam Marg, Mansarovar, Jaipur - 302020, Dist.Jaipur, Rajasthan",8048371602,571
Baby Comb,,Ramdev Novelty Centre,https://www.indiamart.com/ramdev-novelty-centre/?pos=106&kwd=baby brush and swab&tags=||||8954.051||product|||NA|rsf:gd-|-stype:attr=1|qr_nm:gd|res:RC3|com-cf:nl|ptrs:na|ktp:N0|mc:189958|mtp:S|qry_typ:P|lang:en|wc:4|cs:8905|v=4,False,Kasi Chetty Street,Chennai,"No. 20/53, Kasi Chetty Street, 1st Floor, Kasi Chetty Street, Chennai - 600079, Dist.Chennai, Tamil Nadu",8048372571,672
greenbell-baby-hair-brush,,SPJ International,https://www.indiamart.com/spj-international/?pos=107&kwd=baby brush and swab&tags=||||9829.308||product|||NA|rsf:gd-|-stype:attr=1|qr_nm:gd|res:RC3|com-cf:nl|ptrs:na|ktp:N0|mc:189958|mtp:S|qry_typ:P|lang:en|wc:4|cs:8905|v=4,False,,Howrah,"29 Ballygunge Park Ballygunge Kolkata, Howrah - 700019, Dist.Howrah, West Bengal",8069013445,111
Aesthetic Hair Brush Comb,,Frenzyk,https://www.indiamart.com/frenzyk-new-delhi/?pos=108&kwd=baby brush and swab&tags=||||8752.144|Price|product|||NA|rsf:gd-|-stype:attr=1|qr_nm:gd|res:RC3|com-cf:nl|ptrs:na|ktp:N0|mc:189958|mtp:S|qry_typ:P|lang:en|wc:4|cs:8905|v=4,False,,New Delhi,"1/7530 Street No-12 East Gorakh Park, Shahdara East Delhi, New Delhi - 110032, Dist.Delhi, Delhi",8069857446,600
Frida Baby The 3-Step Cradle Cap System,,Bhejo Ecommerce Private Limited,https://www.indiamart.com/bhejo-ecommerce-private-limited/?pos=109&kwd=baby brush and swab&tags=||||8211.142|Price|product|||NA|rsf:gd-|-stype:attr=1|qr_nm:gd|res:RC3|com-cf:nl|ptrs:na|ktp:N0|mc:189958|mtp:S|qry_typ:P|lang:en|wc:4|cs:8905|v=4,False,,Mumbai,"Lotus House, Near Lathia Rubber Factoty, Off Andheri Kurla Rd, Sakinaka, Andheri East, Mumbai-72, Mumbai - 400072, Dist.Mumbai, Maharashtra",8069728299,702
Baby Hair Brush,,Maa N Mee,https://www.indiamart.com/maanmee-pune/?pos=110&kwd=baby brush and swab&tags=||||8307.81||product|||NA|rsf:gd-|-stype:attr=1|qr_nm:gd|res:RC3|com-cf:nl|ptrs:na|ktp:N0|mc:189958|mtp:S|qry_typ:P|lang:en|wc:4|cs:8905|v=4,False,Kharadi,Pune,"Majestic Plaza, Shop No. 2, Next To Columbia Asia Hospital, Kharadi, Pune - 411014, Dist.Pune, Maharashtra",8043840338,
Baby Hair Brush with Comb,,Flo-Rite Baby Products Pvt. Ltd.,https://www.indiamart.com/florite-baby-products/?pos=111&kwd=baby brush and swab&tags=||||8211.142||product|||NA|rsf:gd-|-stype:attr=1|qr_nm:gd|res:RC3|com-cf:nl|ptrs:na|ktp:N0|mc:189958|mtp:S|qry_typ:P|lang:en|wc:4|cs:8905|v=4,False,Bhandup West,Mumbai,"C-Wing, Gala No. 101/106, 1st Floor, Shiva Estate, Lake Road, Nr. Tata Power House, Bhandup (W), Bhandup West, Mumbai - 400078, Dist.Mumbai, Maharashtra",8043865984,
Samrat Baby Brush,,Jay Goga Marketing,https://www.indiamart.com/jay-goga-marketing-madurai/?pos=112&kwd=baby brush and swab&tags=||||8706.587|Price|product|||NA|rsf:gd-|-stype:attr=1|qr_nm:gd|res:RC3|com-cf:nl|ptrs:na|ktp:N0|mc:189958|mtp:S|qry_typ:P|lang:en|wc:4|cs:8905|v=4,False,madurai,Madurai,"munsali madurai, madurai, Madurai - 625001, Dist.Madurai, Tamil Nadu",8044017514,
"Blue Automatic Baby Nail Trimmer, Electric, 3-12 Months",https://www.indiamart.com/proddetail/automatic-baby-nail-trimmer-2853948136212.html?pos=113&kwd=baby brush and swab&tags=||||8230.883|Price|product|||TS|rsf:gd-|-stype:attr=1|qr_nm:gd|res:RC3|com-cf:nl|ptrs:na|ktp:N0|mc:189958|mtp:S|qry_typ:P|lang:en|wc:4|cs:8905|v=4,Manisha Enterprise,https://www.indiamart.com/manishaenterprisesurat/?pos=113&kwd=baby brush and swab&tags=||||8230.883|Price|product|||TS|rsf:gd-|-stype:attr=1|qr_nm:gd|res:RC3|com-cf:nl|ptrs:na|ktp:N0|mc:189958|mtp:S|qry_typ:P|lang:en|wc:4|cs:8905|v=4,False,Amroli,Surat,"GF C-75, Somnath Adarshnagar 1, Chprabhata Road, Amroli, Amroli, Surat - 394107, Dist.Surat, Gujarat",7949372906,
New Baby Nail File,https://www.indiamart.com/proddetail/new-baby-nail-file-2851620556688.html?pos=114&kwd=baby brush and swab&tags=||||8230.883|Price|product|||MDC|rsf:gd-|-stype:attr=1|qr_nm:gd|res:RC3|com-cf:nl|ptrs:na|ktp:N0|mc:189958|mtp:S|qry_typ:P|lang:en|wc:4|cs:8905|v=4,Bosig Mart,https://www.indiamart.com/bosigmart/?pos=114&kwd=baby brush and swab&tags=||||8230.883|Price|product|||MDC|rsf:gd-|-stype:attr=1|qr_nm:gd|res:RC3|com-cf:nl|ptrs:na|ktp:N0|mc:189958|mtp:S|qry_typ:P|lang:en|wc:4|cs:8905|v=4,False,Dabholi Village,Surat,"27, Hari Om Nagar Society, Jahangirpura, Dabholi Village, Surat - 395005, Dist.Surat, Gujarat",7942837519,
Baby Care Kit Set,https://www.indiamart.com/proddetail/baby-care-kit-set-2853670493055.html?pos=115&kwd=baby brush and swab&tags=||||8663.873|Price|product|||MDC|rsf:gd-|-stype:attr=1|qr_nm:gd|res:RC3|com-cf:nl|ptrs:na|ktp:N0|mc:189958|mtp:S|qry_typ:P|lang:en|wc:4|cs:8905|v=4,Nipika Vrapped Gifting,https://www.indiamart.com/nipika-vrapped-gifting/?pos=115&kwd=baby brush and swab&tags=||||8663.873|Price|product|||MDC|rsf:gd-|-stype:attr=1|qr_nm:gd|res:RC3|com-cf:nl|ptrs:na|ktp:N0|mc:189958|mtp:S|qry_typ:P|lang:en|wc:4|cs:8905|v=4,False,Bengaluru Urban,Bengaluru,"9/1, 23rd Cross Road, Magadi Road, KP Agrahara, Bengaluru Urban, Bengaluru - 560023, Dist.Bengaluru, Karnataka",7949328723,
"Baby Nail Clipper Kit - BLUE, For Babies",https://www.indiamart.com/proddetail/baby-nail-clipper-kit-blue-2852393642130.html?pos=116&kwd=baby brush and swab&tags=||||8752.144|Price|product|||TS|rsf:gd-|-stype:attr=1|qr_nm:gd|res:RC3|com-cf:nl|ptrs:na|ktp:N0|mc:189958|mtp:S|qry_typ:P|lang:en|wc:4|cs:8905|v=4,Ekta Overseas,https://www.indiamart.com/ektaoverseas-newdelhi/?pos=116&kwd=baby brush and swab&tags=||||8752.144|Price|product|||TS|rsf:gd-|-stype:attr=1|qr_nm:gd|res:RC3|com-cf:nl|ptrs:na|ktp:N0|mc:189958|mtp:S|qry_typ:P|lang:en|wc:4|cs:8905|v=4,False,Shahdara,New Delhi,"1/95, Gali No.3, Near Navjeevan Phisical Center, Vishwas Nagar, Shahdara,, Shahdara, New Delhi - 110032, Dist.Delhi, Delhi",7942628926,
"PINK Baby Healthcare and Grooming Kit, Packaging Type: Box, 3-12 Months",https://www.indiamart.com/proddetail/baby-healthcare-and-grooming-kit-2852059991391.html?pos=117&kwd=baby brush and swab&tags=||||8752.144|Price|product|||TS|rsf:gd-|-stype:attr=1|qr_nm:gd|res:RC3|com-cf:nl|ptrs:na|ktp:N0|mc:189958|mtp:S|qry_typ:P|lang:en|wc:4|cs:8905|v=4,Jainone Hub,https://www.indiamart.com/jainonehub/?pos=117&kwd=baby brush and swab&tags=||||8752.144|Price|product|||TS|rsf:gd-|-stype:attr=1|qr_nm:gd|res:RC3|com-cf:nl|ptrs:na|ktp:N0|mc:189958|mtp:S|qry_typ:P|lang:en|wc:4|cs:8905|v=4,False,Mandoli,New Delhi,"J- 8, Near Frooti Godown, Gali No. 4, Melaram Farm House Mandoli Sewadham Road, Mandoli, New Delhi - 110093, Dist.Delhi, Delhi",8048963941,
"Syga Pink Baby Healthcare Kit, Packaging Type: Box",https://www.indiamart.com/proddetail/baby-healthcare-kit-19811576730.html?pos=118&kwd=baby brush and swab&tags=||||8228.275|Price|product|||TS|rsf:gd-|-stype:attr=1|qr_nm:gd|res:RC3|com-cf:nl|ptrs:na|ktp:N0|mc:189958|mtp:S|qry_typ:P|lang:en|wc:4|cs:8905|v=4,Syga Home Furnishing,https://www.indiamart.com/sygahomefurnishing/?pos=118&kwd=baby brush and swab&tags=||||8228.275|Price|product|||TS|rsf:gd-|-stype:attr=1|qr_nm:gd|res:RC3|com-cf:nl|ptrs:na|ktp:N0|mc:189958|mtp:S|qry_typ:P|lang:en|wc:4|cs:8905|v=4,False,Navrangpura,Ahmedabad,"A-503, Samudra Complex, Near Girish Cold Drinks C. G. Road, Navrangpura, Navrangpura, Ahmedabad - 380009, Dist.Ahmedabad, Gujarat",8048985837,
