product_title,product_link,company_name,company_link,is_verified_exporter,city_region,city,address_details,phone_number,phone_number_extension
"Conava White Kids u shape brush, Packaging Type: Box, 1-2 Years",https://www.indiamart.com/proddetail/kids-u-shape-brush-2850432140612.html?pos=1&kwd=baby brush and swab&tags=BA||||8752.144|Price|product|||TS|rsf:gd-|-stype:attr=1|qr_nm:gd|res:RC3|com-cf:nl|ptrs:na|ktp:N0|mc:189958|mtp:S|qry_typ:P|lang:en|wc:4|flavl:0|cs:9668|v=4,House Of Luxury,https://www.theholworld.net/?pos=1&kwd=baby brush and swab&tags=BA||||8752.144|Price|product|||TS|rsf:gd-|-stype:attr=1|qr_nm:gd|res:RC3|com-cf:nl|ptrs:na|ktp:N0|mc:189958|mtp:S|qry_typ:P|lang:en|wc:4|flavl:0|cs:9668|v=4,False,Budh Vihar,New Delhi,"Plot No - 5, Kh. No. - 89/10/2, 1, Block No. - I-1, Budh Vihar Phase 1, Delhi, North West Delhi, Del, Budh Vihar, New Delhi - 110086, Dist.Delhi, Delhi",7942819716,
"Yellow Baby Grooming Kit, Packaging Type: Plastic Jar, 3-12 Months",https://www.indiamart.com/proddetail/baby-grooming-kit-2852082923448.html?pos=2&kwd=baby brush and swab&tags=BB||||8624.416|Price|product|||MDC|rsf:gd-|-stype:attr=1|qr_nm:gd|res:RC3|com-cf:nl|ptrs:na|ktp:N0|mc:189958|mtp:S|qry_typ:P|lang:en|wc:4|flavl:0|cs:9668|v=4,Dayawanti Traders,https://www.indiamart.com/dayawati-trader/?pos=2&kwd=baby brush and swab&tags=BB||||8624.416|Price|product|||MDC|rsf:gd-|-stype:attr=1|qr_nm:gd|res:RC3|com-cf:nl|ptrs:na|ktp:N0|mc:189958|mtp:S|qry_typ:P|lang:en|wc:4|flavl:0|cs:9668|v=4,False,Indira Colony,Hisar,"Plot No. 137 Dhani Kishandutt, Near Asha High School, Nancy Beauty Parlour, Indira Colony, Indira Colony, Hisar - 125001, Dist.Hisar, Haryana",7942701403,
Baby Care Kit 10 pcs,https://www.indiamart.com/proddetail/baby-care-kit-10-pcs-2854721492697.html?pos=3&kwd=baby brush and swab&tags=BB||||8741.812|Price|product|||TS|rsf:gd-|-stype:attr=1|qr_nm:gd|res:RC3|com-cf:nl|ptrs:na|ktp:N0|mc:189958|mtp:S|qry_typ:P|lang:en|wc:4|flavl:0|cs:9668|v=4,Om Deal Online,https://www.indiamart.com/om-deal-online/?pos=3&kwd=baby brush and swab&tags=BB||||8741.812|Price|product|||TS|rsf:gd-|-stype:attr=1|qr_nm:gd|res:RC3|com-cf:nl|ptrs:na|ktp:N0|mc:189958|mtp:S|qry_typ:P|lang:en|wc:4|flavl:0|cs:9668|v=4,False,Sector 93,Gurugram,"114, IMT Road, Government High School, Hayatpur, Sector 93, Gurugram - 122505, Dist.Gurgaon, Haryana",7942836824,
"JNSM SPARK muticolor Soft Adjustable Bath Cap for Toddler/Baby/Kids, 1-2 Years",https://www.indiamart.com/proddetail/soft-adjustable-bath-cap-for-toddler-baby-kids-2853672174597.html?pos=4&kwd=baby brush and swab&tags=BA||||8230.883|Price|product|||MDC|rsf:gd-|-stype:attr=1|qr_nm:gd|res:RC3|com-cf:nl|ptrs:na|ktp:N0|mc:189958|mtp:S|qry_typ:P|lang:en|wc:4|flavl:0|cs:9668|v=4,Jnsm Spark,https://www.indiamart.com/jnsm-spark/?pos=4&kwd=baby brush and swab&tags=BA||||8230.883|Price|product|||MDC|rsf:gd-|-stype:attr=1|qr_nm:gd|res:RC3|com-cf:nl|ptrs:na|ktp:N0|mc:189958|mtp:S|qry_typ:P|lang:en|wc:4|flavl:0|cs:9668|v=4,False,Dabholi,Surat,"3rd Floor Flat-302, Shukan Valley BLDG-F, OPP Hari Darshan, Dabholi Road, Dabholi, Surat - 395004, Dist.Surat, Gujarat",8045166587,
"MAJESTIQUE Multicolor CMB545 BABY GROOMING KIT WITH SOFT TOWEL, Packaging Type: POUCH, 3-12 Months",https://www.indiamart.com/proddetail/cmb545-baby-grooming-kit-with-soft-towel-2853131877855.html?pos=5&kwd=baby brush and swab&tags=CC||||8752.144|Price|product|||TS|rsf:gd-|-stype:attr=1|qr_nm:gd|res:RC3|com-cf:nl|ptrs:na|ktp:N0|mc:189958|mtp:S|qry_typ:P|lang:en|wc:4|flavl:0|cs:9668|v=4,Briota Brands Private Limited,https://www.indiamart.com/briota-brands/?pos=5&kwd=baby brush and swab&tags=CC||||8752.144|Price|product|||TS|rsf:gd-|-stype:attr=1|qr_nm:gd|res:RC3|com-cf:nl|ptrs:na|ktp:N0|mc:189958|mtp:S|qry_typ:P|lang:en|wc:4|flavl:0|cs:9668|v=4,False,Pitampura,New Delhi,"50, 1st Floor, Sharda Niketan Pitampura, Pitampura, New Delhi - 110034, Dist.Delhi, Delhi",8043843967,
Baby Plastic Grooming Toy Set,https://www.indiamart.com/proddetail/baby-plastic-grooming-toy-set-25736131391.html?pos=6&kwd=baby brush and swab&tags=CC||||8752.144|Price|product|||MDC|rsf:gd-|-stype:attr=1|qr_nm:gd|res:RC3|com-cf:nl|ptrs:na|ktp:N0|mc:189958|mtp:S|qry_typ:P|lang:en|wc:4|flavl:0|cs:9668|v=4,Little Kingdom Baby Product,https://www.indiamart.com/little-kingdombaby-product/?pos=6&kwd=baby brush and swab&tags=CC||||8752.144|Price|product|||MDC|rsf:gd-|-stype:attr=1|qr_nm:gd|res:RC3|com-cf:nl|ptrs:na|ktp:N0|mc:189958|mtp:S|qry_typ:P|lang:en|wc:4|flavl:0|cs:9668|v=4,False,Bawana,New Delhi,"Plot No. 16, PKT-G, Sector-3, DSIIDC, Bawana, North West Delhi, Bawana, New Delhi - 110039, Dist.Delhi, Delhi",8047648589,
"Paper stick 100 cotton swabs flat box for hygiene packet, For Home, Non-Sterile",https://www.indiamart.com/proddetail/paper-stick-100-cotton-swabs-flat-box-for-hygiene-packet-2853477133088.html?pos=7&kwd=baby brush and swab&tags=||||8230.883|Price|product|||TS|rsf:gd-|-stype:attr=1|qr_nm:gd|res:RC3|com-cf:nl|ptrs:na|ktp:N0|mc:189958|mtp:S|qry_typ:P|lang:en|wc:4|flavl:0|cs:9668|v=4,Tulsi Hygiene Care,https://www.indiamart.com/tulsihygiene-care/?pos=7&kwd=baby brush and swab&tags=||||8230.883|Price|product|||TS|rsf:gd-|-stype:attr=1|qr_nm:gd|res:RC3|com-cf:nl|ptrs:na|ktp:N0|mc:189958|mtp:S|qry_typ:P|lang:en|wc:4|flavl:0|cs:9668|v=4,False,Mota Varachha,Surat,"Ground Floor, Plot No-31, Sarjan Bungalows, Mota Varachha, Mota Varachha, Surat - 394101, Dist.Surat, Gujarat",7949089997,
Baby Cotton Buds,https://www.indiamart.com/proddetail/baby-cotton-buds-25130146733.html?pos=8&kwd=baby brush and swab&tags=||||8237.554|Price|product|||TS|rsf:gd-|-stype:attr=1|qr_nm:gd|res:RC3|com-cf:nl|ptrs:na|ktp:N0|mc:189958|mtp:S|qry_typ:P|lang:en|wc:4|flavl:0|cs:9668|v=4,Flosee Enterprise,https://www.floseeenterprise.co.in/?pos=8&kwd=baby brush and swab&tags=||||8237.554|Price|product|||TS|rsf:gd-|-stype:attr=1|qr_nm:gd|res:RC3|com-cf:nl|ptrs:na|ktp:N0|mc:189958|mtp:S|qry_typ:P|lang:en|wc:4|flavl:0|cs:9668|v=4,False,Sector 27,Gandhinagar,"Plot No E/159, GIDC Electronic Estate, Sector 26, Ghandhinagar, Sector 27, Gandhinagar - 382027, Gujarat",8048980880,
Silicone Baby Toothbrush,https://www.indiamart.com/proddetail/silicone-baby-toothbrush-2854238911348.html?pos=9&kwd=baby brush and swab&tags=||||8752.144|Price|product|||TS|rsf:gd-|-stype:attr=1|qr_nm:gd|res:RC3|com-cf:nl|ptrs:na|ktp:N0|mc:189958|mtp:S|qry_typ:P|lang:en|wc:4|flavl:0|cs:9668|v=4,VN Enterprise,https://www.indiamart.com/vn-enterprise-new-delhi/?pos=9&kwd=baby brush and swab&tags=||||8752.144|Price|product|||TS|rsf:gd-|-stype:attr=1|qr_nm:gd|res:RC3|com-cf:nl|ptrs:na|ktp:N0|mc:189958|mtp:S|qry_typ:P|lang:en|wc:4|flavl:0|cs:9668|v=4,False,,New Delhi,"Wz-1013d, Gali No-13, Sadh Nagar, Palam Colony, New Delhi - 110045, Dist.Delhi, Delhi",8045734282,
Baby Cotton Swab,https://www.indiamart.com/proddetail/baby-cotton-swab-2849014134188.html?pos=10&kwd=baby brush and swab&tags=||||8230.883|Price|product|||TS|rsf:gd-|-stype:attr=1|qr_nm:gd|res:RC3|com-cf:nl|ptrs:na|ktp:N0|mc:189958|mtp:S|qry_typ:P|lang:en|wc:4|flavl:0|cs:9668|v=4,Dev Enterprise,https://www.magicindustries.co.in/?pos=10&kwd=baby brush and swab&tags=||||8230.883|Price|product|||TS|rsf:gd-|-stype:attr=1|qr_nm:gd|res:RC3|com-cf:nl|ptrs:na|ktp:N0|mc:189958|mtp:S|qry_typ:P|lang:en|wc:4|flavl:0|cs:9668|v=4,False,Pipodara,Surat,"Block No 293/a Building No-c, Ground Floor, Bajrang Aasteed, Kanyasi Road, Pipodara, Pipodara, Surat - 394110, Dist.Surat, Gujarat",8048958269,
Bamboo Buds Round Box,https://www.indiamart.com/proddetail/bamboo-buds-round-box-2854309437888.html?pos=11&kwd=baby brush and swab&tags=||||8752.144|Price|product|||TS|rsf:gd-|-stype:attr=1|qr_nm:gd|res:RC3|com-cf:nl|ptrs:na|ktp:N0|mc:189958|mtp:S|qry_typ:P|lang:en|wc:4|flavl:0|cs:9668|v=4,Greeniecan India,https://www.greeniecan.co.in/?pos=11&kwd=baby brush and swab&tags=||||8752.144|Price|product|||TS|rsf:gd-|-stype:attr=1|qr_nm:gd|res:RC3|com-cf:nl|ptrs:na|ktp:N0|mc:189958|mtp:S|qry_typ:P|lang:en|wc:4|flavl:0|cs:9668|v=4,True,,New Delhi,"Ground Floor, House No- B-7/182, Phase Iv, Aaya Nagar, New Delhi - 110047, Dist.Delhi, Delhi",8048265707,
Baby Care Kit,https://www.indiamart.com/proddetail/baby-care-kit-2854226129812.html?pos=12&kwd=baby brush and swab&tags=||||8230.883|Price|product|||TS|rsf:gd-|-stype:attr=1|qr_nm:gd|res:RC3|com-cf:nl|ptrs:na|ktp:N0|mc:189958|mtp:S|qry_typ:P|lang:en|wc:4|flavl:0|cs:9668|v=4,BABYHOLIC,https://www.babyholic.in/?pos=12&kwd=baby brush and swab&tags=||||8230.883|Price|product|||TS|rsf:gd-|-stype:attr=1|qr_nm:gd|res:RC3|com-cf:nl|ptrs:na|ktp:N0|mc:189958|mtp:S|qry_typ:P|lang:en|wc:4|flavl:0|cs:9668|v=4,False,,Surat,"Ground Floor, Plot No. F/56/, And F/57, Laxmi Narayan Industrial Estate, Udhana, Kailash Fashion, Surat - 394210, Dist.Surat, Gujarat",8045732096,
"IMPORTED Orange Baby Finger Toothbrush, Packaging Type: Box, 1-2 Years",https://www.indiamart.com/proddetail/baby-finger-toothbrush-2852519064497.html?pos=13&kwd=baby brush and swab&tags=||||8211.142|Price|product|||TS|rsf:gd-|-stype:attr=1|qr_nm:gd|res:RC3|com-cf:nl|ptrs:na|ktp:N0|mc:189958|mtp:S|qry_typ:P|lang:en|wc:4|flavl:0|cs:9668|v=4,P For Panda Baby Products Private Limited,https://www.p4pandababyproducts.com/?pos=13&kwd=baby brush and swab&tags=||||8211.142|Price|product|||TS|rsf:gd-|-stype:attr=1|qr_nm:gd|res:RC3|com-cf:nl|ptrs:na|ktp:N0|mc:189958|mtp:S|qry_typ:P|lang:en|wc:4|flavl:0|cs:9668|v=4,False,Goregaon West,Mumbai,"904 A Wing,9 Th Floor,Triple S Heights,Jakeria Road, Goregaon West, Mumbai - 400064, Dist.Mumbai, Maharashtra",7942710871,
"LuvLap Stylish Infant Hair Brush and Comb Kit, Suitable from Birth 0+month baby (White) 18607",https://www.indiamart.com/proddetail/luvlap-stylish-infant-hair-brush-and-comb-kit-suitable-from-birth-0-month-baby-white-18607-2853231074673.html?pos=14&kwd=baby brush and swab&tags=||||8614.241|Price|product|||MDC|rsf:gd-|-stype:attr=1|qr_nm:gd|res:RC3|com-cf:nl|ptrs:na|ktp:N0|mc:189958|mtp:S|qry_typ:P|lang:en|wc:4|flavl:0|cs:9668|v=4,M.M. Toy World,https://www.indiamart.com/mmtoyworld/?pos=14&kwd=baby brush and swab&tags=||||8614.241|Price|product|||MDC|rsf:gd-|-stype:attr=1|qr_nm:gd|res:RC3|com-cf:nl|ptrs:na|ktp:N0|mc:189958|mtp:S|qry_typ:P|lang:en|wc:4|flavl:0|cs:9668|v=4,False,Achli Gate,Batala,"M.M. Toys World, Bedian Gali, Khujari Gate, Gurdaspur, Achli Gate, Batala - 143505, Dist.Gurdaspur, Punjab",,
Chicco Tooth brush,https://www.indiamart.com/proddetail/chicco-tooth-brush-2851027746433.html?pos=15&kwd=baby brush and swab&tags=||||8740.707|Price|product|||TS|rsf:gd-|-stype:attr=1|qr_nm:gd|res:RC3|com-cf:nl|ptrs:na|ktp:N0|mc:189958|mtp:S|qry_typ:P|lang:en|wc:4|cs:8905|v=4,Arihant Solutions,https://www.indiamart.com/arihantsolutions/?pos=15&kwd=baby brush and swab&tags=||||8740.707|Price|product|||TS|rsf:gd-|-stype:attr=1|qr_nm:gd|res:RC3|com-cf:nl|ptrs:na|ktp:N0|mc:189958|mtp:S|qry_typ:P|lang:en|wc:4|cs:8905|v=4,False,JLPL Industrial Area,Sas Nagar,"First Floor Plot No. 1250 JLPL, Sector 82, JLPL Industrial Area, Sas Nagar - 160055, Dist.Mohali, Punjab",8047645834,
Baby Hair Brush Comb,https://www.indiamart.com/proddetail/baby-hair-brush-comb-2853943500530.html?pos=16&kwd=baby brush and swab&tags=||||8752.144|Price|product|||TS|rsf:gd-|-stype:attr=1|qr_nm:gd|res:RC3|com-cf:nl|ptrs:na|ktp:N0|mc:189958|mtp:S|qry_typ:P|lang:en|wc:4|cs:8905|v=4,The Creators,https://www.indiamart.com/thecreators-newdelhi/?pos=16&kwd=baby brush and swab&tags=||||8752.144|Price|product|||TS|rsf:gd-|-stype:attr=1|qr_nm:gd|res:RC3|com-cf:nl|ptrs:na|ktp:N0|mc:189958|mtp:S|qry_typ:P|lang:en|wc:4|cs:8905|v=4,False,Sultanpuri,New Delhi,"275-76, Block P-3, Sultanpuri North West Delhi, Sultanpuri, New Delhi - 110086, Dist.Delhi, Delhi",8047549858,
"Women Hair Bits ( small baby), For Personal, 3-12 Months",https://www.indiamart.com/proddetail/hair-bits-small-baby-2854500101730.html?pos=17&kwd=baby brush and swab&tags=||||8211.142||product|||TS|rsf:gd-|-stype:attr=1|qr_nm:gd|res:RC3|com-cf:nl|ptrs:na|ktp:N0|mc:189958|mtp:S|qry_typ:P|lang:en|wc:4|cs:8905|v=4,Perfect Immitation Jewellery,https://www.perfecthairaccessories.com/?pos=17&kwd=baby brush and swab&tags=||||8211.142||product|||TS|rsf:gd-|-stype:attr=1|qr_nm:gd|res:RC3|com-cf:nl|ptrs:na|ktp:N0|mc:189958|mtp:S|qry_typ:P|lang:en|wc:4|cs:8905|v=4,False,S. C. Court,Mumbai,"SHOP NO.10, 3RD FLOOR, 12/14, SASOOR BUILDING,, S. C. Court, Mumbai - 400002, Dist.Mumbai, Maharashtra",8048950643,
"China Multicolor Silicone Baby Toothbrush, Packaging Type: Box, 3-12 Months baby mouth brush",https://www.indiamart.com/proddetail/china-multicolor-silicone-baby-toothbrush-packaging-type-box-3-12-months-baby-mouth-brush-25962111973.html?pos=18&kwd=baby brush and swab&tags=||||8752.144|Price|product|||TS|rsf:gd-|-stype:attr=1|qr_nm:gd|res:RC3|com-cf:nl|ptrs:na|ktp:N0|mc:189958|mtp:S|qry_typ:P|lang:en|wc:4|cs:8905|v=4,Shiv Darshan Sansthan,https://www.shivdarshansansthan.com/?pos=18&kwd=baby brush and swab&tags=||||8752.144|Price|product|||TS|rsf:gd-|-stype:attr=1|qr_nm:gd|res:RC3|com-cf:nl|ptrs:na|ktp:N0|mc:189958|mtp:S|qry_typ:P|lang:en|wc:4|cs:8905|v=4,False,Pandav Nagar,New Delhi,"Bunglow, Plot No. 10, Pandav Nagar, New Delhi - 110092, Dist.Delhi, Delhi",8048984990,
Plastic Baby Hair Brush,https://www.indiamart.com/proddetail/plastic-baby-hair-brush-2851921816988.html?pos=19&kwd=baby brush and swab&tags=||||8211.142|Price|product|||TS|rsf:gd-|-stype:attr=1|qr_nm:gd|res:RC3|com-cf:nl|ptrs:na|ktp:N0|mc:189958|mtp:S|qry_typ:P|lang:en|wc:4|cs:8905|v=4,Vijay Brush Co.,https://www.vijaybrush.com/?pos=19&kwd=baby brush and swab&tags=||||8211.142|Price|product|||TS|rsf:gd-|-stype:attr=1|qr_nm:gd|res:RC3|com-cf:nl|ptrs:na|ktp:N0|mc:189958|mtp:S|qry_typ:P|lang:en|wc:4|cs:8905|v=4,False,Sharma Estate,Mumbai,"23/A/606, Sneh Co-Op Hsg Sty Ltd, Bimbisar Nagar, Goregaon, Mumbai Suburban, Sharma Estate, Mumbai - 400063, Dist.Mumbai, Maharashtra",7942871572,
"Baby Wooden Hair Brush, More than 12 months",https://www.indiamart.com/proddetail/baby-wooden-hair-brush-2854575390330.html?pos=20&kwd=baby brush and swab&tags=||||8752.144|Price|product|||TS|rsf:gd-|-stype:attr=1|qr_nm:gd|res:RC3|com-cf:nl|ptrs:na|ktp:N0|mc:189958|mtp:S|qry_typ:P|lang:en|wc:4|cs:8905|v=4,IM Corporation,https://www.imcorporation.in/?pos=20&kwd=baby brush and swab&tags=||||8752.144|Price|product|||TS|rsf:gd-|-stype:attr=1|qr_nm:gd|res:RC3|com-cf:nl|ptrs:na|ktp:N0|mc:189958|mtp:S|qry_typ:P|lang:en|wc:4|cs:8905|v=4,False,Okhla Industrial Estate,New Delhi,"DDA Shed Okhla Industrial Area Phase-1 Delhi C-77 Delhi South Delhi Ground Floor, Okhla Industrial Estate, New Delhi - 110020, Dist.Delhi, Delhi",8048263469,
Detangling Kids Gentle Tangle Wet Dry Bristles Handle Massage Detangling Comb Hair Brush,https://www.indiamart.com/proddetail/detangling-kids-gentle-tangle-wet-dry-bristles-handle-massage-detangling-comb-hair-brush-25945966612.html?pos=21&kwd=baby brush and swab&tags=||||8355.778|Price|product|||TS|rsf:gd-|-stype:attr=1|qr_nm:gd|res:RC3|com-cf:nl|ptrs:na|ktp:N0|mc:189958|mtp:S|qry_typ:P|lang:en|wc:4|cs:8905|v=4,Rightbrain Creations Private Limited,https://www.rbcpvtltd.com/?pos=21&kwd=baby brush and swab&tags=||||8355.778|Price|product|||TS|rsf:gd-|-stype:attr=1|qr_nm:gd|res:RC3|com-cf:nl|ptrs:na|ktp:N0|mc:189958|mtp:S|qry_typ:P|lang:en|wc:4|cs:8905|v=4,False,Rishabhdev,Rishabhdeo,"Ground Floor, 01, Laxmi Devi W/o Bihari Lal Jain, Pagaliyaji Road, Rishabhdev, Rishabhdeo - 313802, Dist.Udaipur, Rajasthan",8046062538,
Pink Cotton Baby Hooded Towels,https://www.indiamart.com/proddetail/cotton-baby-hooded-towels-24733791388.html?pos=22&kwd=baby brush and swab&tags=||||8752.144|Price|product|||TS|rsf:gd-|-stype:attr=1|qr_nm:gd|res:RC3|com-cf:nl|ptrs:na|ktp:N0|mc:189958|mtp:S|qry_typ:P|lang:en|wc:4|cs:8905|v=4,Swastik Enterprises,https://www.indiamart.com/swastikentpndelhi/?pos=22&kwd=baby brush and swab&tags=||||8752.144|Price|product|||TS|rsf:gd-|-stype:attr=1|qr_nm:gd|res:RC3|com-cf:nl|ptrs:na|ktp:N0|mc:189958|mtp:S|qry_typ:P|lang:en|wc:4|cs:8905|v=4,False,Shastri Nagar,New Delhi,"M 29, Shastri Nagar, Street No. 1, Shastri Nagar, New Delhi - 110052, Dist.Delhi, Delhi",8048607766,
"Soft White Littloo Baby Finger Tooth Brush, Packaging Type: Box",https://www.indiamart.com/proddetail/littloo-baby-finger-tooth-brush-21930505797.html?pos=23&kwd=baby brush and swab&tags=||||8752.144|Price|product|||TS|rsf:gd-|-stype:attr=1|qr_nm:gd|res:RC3|com-cf:nl|ptrs:na|ktp:N0|mc:189958|mtp:S|qry_typ:P|lang:en|wc:4|cs:8905|v=4,Salvia Cosmeceuticals Private Limited,https://www.salviacosmeceuticals.in/?pos=23&kwd=baby brush and swab&tags=||||8752.144|Price|product|||TS|rsf:gd-|-stype:attr=1|qr_nm:gd|res:RC3|com-cf:nl|ptrs:na|ktp:N0|mc:189958|mtp:S|qry_typ:P|lang:en|wc:4|cs:8905|v=4,False,Ashok Vihar,New Delhi,"301-A, Prop. No.48, Second Floor, Rama Road, Najafgarh Road Industrial Area, Kirti Nagar, New Delhi,, Ashok Vihar, New Delhi - 110052, Dist.Delhi, Delhi",7942559667,
Hair Curler Brush & Comb,https://www.indiamart.com/proddetail/hair-curler-brush-comb-2854982041955.html?pos=24&kwd=baby brush and swab&tags=||||8211.142|Price|product|||TS|rsf:gd-|-stype:attr=1|qr_nm:gd|res:RC3|com-cf:nl|ptrs:na|ktp:N0|mc:189958|mtp:S|qry_typ:P|lang:en|wc:4|cs:8905|v=4,RAF India,https://www.rafindia.co.in/?pos=24&kwd=baby brush and swab&tags=||||8211.142|Price|product|||TS|rsf:gd-|-stype:attr=1|qr_nm:gd|res:RC3|com-cf:nl|ptrs:na|ktp:N0|mc:189958|mtp:S|qry_typ:P|lang:en|wc:4|cs:8905|v=4,False,Pydhonie,Mumbai,"425, Ibrahim Rehmatulla Road, Pydhonie, Mumbai - 400003, Dist.Mumbai, Maharashtra",8047635175,
"Remonde Plastic Flat Hair Brush, For Home",https://www.indiamart.com/proddetail/flat-hair-brush-3741662948.html?pos=25&kwd=baby brush and swab&tags=||||8211.142|Price|product|||TS|rsf:gd-|-stype:attr=1|qr_nm:gd|res:RC3|com-cf:nl|ptrs:na|ktp:N0|mc:189958|mtp:S|qry_typ:P|lang:en|wc:4|cs:8905|v=4,Remonde Plasmetiks,https://www.remondeplasmetiks.com/?pos=25&kwd=baby brush and swab&tags=||||8211.142|Price|product|||TS|rsf:gd-|-stype:attr=1|qr_nm:gd|res:RC3|com-cf:nl|ptrs:na|ktp:N0|mc:189958|mtp:S|qry_typ:P|lang:en|wc:4|cs:8905|v=4,False,Goregaon East,Mumbai,"50/51, Jagat Satguru Industrial Estate, 1st Floor, Vishweshwar Road Off Aarey Road, Goregaon East, Mumbai - 400063, Dist.Mumbai, Maharashtra",8046041673,
"Deodap Multicolor Cartoon Design Kids Hair Brush 6471, Packaging Type: Polybag, 5-7 Years",https://www.indiamart.com/proddetail/cartoon-design-kids-hair-brush-6471-2853389448091.html?pos=26&kwd=baby brush and swab&tags=||||8038.093|Price|product|||TS|rsf:gd-|-stype:attr=1|qr_nm:gd|res:RC3|com-cf:nl|ptrs:na|ktp:N0|mc:189958|mtp:S|qry_typ:P|lang:en|wc:4|cs:8905|v=4,Deodap,https://www.indiamart.com/deodap/?pos=26&kwd=baby brush and swab&tags=||||8038.093|Price|product|||TS|rsf:gd-|-stype:attr=1|qr_nm:gd|res:RC3|com-cf:nl|ptrs:na|ktp:N0|mc:189958|mtp:S|qry_typ:P|lang:en|wc:4|cs:8905|v=4,False,Rajkot,Rajkot,"plot No. 9 Behind Patanjali Werhouse, Ruda Transport, Saat Hanuman Ahemdabad Road, Rajkot, Rajkot - 360005, Dist.Rajkot, Gujarat",8048972316,
"Toothbrush - Soft Bristle Toothbrush - 3-sided Training Toothbrush With Silicone Head, Inverted Cleaning Toothbrush For Aged 2-12, Children's Cleaning (1 Pc)",https://www.indiamart.com/proddetail/toothbrush-soft-bristle-toothbrush-3-sided-training-toothbrush-with-silicone-head-inverted-cleaning-toothbrush-for-aged-2-12-children-s-cleaning-1-pc-2855039319612.html?pos=27&kwd=baby brush and swab&tags=||||8692.544|Price|product|||MDC|rsf:gd-|-stype:attr=1|qr_nm:gd|res:RC3|com-cf:nl|ptrs:na|ktp:N0|mc:189958|mtp:S|qry_typ:P|lang:en|wc:4|cs:8905|v=4,Demrot Bangles And Manufacture,https://www.indiamart.com/demrotbanglesmanufacture/?pos=27&kwd=baby brush and swab&tags=||||8692.544|Price|product|||MDC|rsf:gd-|-stype:attr=1|qr_nm:gd|res:RC3|com-cf:nl|ptrs:na|ktp:N0|mc:189958|mtp:S|qry_typ:P|lang:en|wc:4|cs:8905|v=4,False,Kishangarh Bas,Alwar,"Vashishtha Market, Kishangarh Bass, Kishangarh Bas, Alwar - 301405, Dist.Alwar, Rajasthan",,
Kids Hair Brush,https://www.indiamart.com/proddetail/kids-hair-brush-2853733779197.html?pos=28&kwd=baby brush and swab&tags=||||8663.873|Price|product|||MDC|rsf:gd-|-stype:attr=1|qr_nm:gd|res:RC3|com-cf:nl|ptrs:na|ktp:N0|mc:189958|mtp:S|qry_typ:P|lang:en|wc:4|cs:8905|v=4,Maya Marketing,https://www.indiamart.com/mayamarketingbengaluru/?pos=28&kwd=baby brush and swab&tags=||||8663.873|Price|product|||MDC|rsf:gd-|-stype:attr=1|qr_nm:gd|res:RC3|com-cf:nl|ptrs:na|ktp:N0|mc:189958|mtp:S|qry_typ:P|lang:en|wc:4|cs:8905|v=4,False,Sampangi Rama Nagar,Bengaluru,"6/1,7 th Cross,SR Nagar, Sri BT Muniyappa Road, Bengaluru Urban, Sampangi Rama Nagar, Bengaluru - 560027, Dist.Bengaluru, Karnataka",8044011151,
Manual Silicon Tooth Brush for 2-6 Years,https://www.indiamart.com/proddetail/silicon-tooth-brush-for-2-6-years-2852926317530.html?pos=29&kwd=baby brush and swab&tags=||||8230.883|Price|product|||MDC|rsf:gd-|-stype:attr=1|qr_nm:gd|res:RC3|com-cf:nl|ptrs:na|ktp:N0|mc:189958|mtp:S|qry_typ:P|lang:en|wc:4|cs:8905|v=4,Uma Enterprise,https://www.indiamart.com/umaenterprisesurat/?pos=29&kwd=baby brush and swab&tags=||||8230.883|Price|product|||MDC|rsf:gd-|-stype:attr=1|qr_nm:gd|res:RC3|com-cf:nl|ptrs:na|ktp:N0|mc:189958|mtp:S|qry_typ:P|lang:en|wc:4|cs:8905|v=4,False,Majura Gate,Surat,"72, Hari Ichchha Industrial Co Op Society, A K Road, Majura Gate, Surat - 395008, Dist.Surat, Gujarat",7942713138,
Silicone Baby Gum Cleaner,https://www.indiamart.com/proddetail/silicone-baby-gum-cleaner-12782306830.html?pos=30&kwd=baby brush and swab&tags=||||8223.226|Price|product|||MDC|rsf:gd-|-stype:attr=1|qr_nm:gd|res:RC3|com-cf:nl|ptrs:na|ktp:N0|mc:189958|mtp:S|qry_typ:P|lang:en|wc:4|cs:8905|v=4,Wecare Solutions,https://www.indiamart.com/wecare-solutions/?pos=30&kwd=baby brush and swab&tags=||||8223.226|Price|product|||MDC|rsf:gd-|-stype:attr=1|qr_nm:gd|res:RC3|com-cf:nl|ptrs:na|ktp:N0|mc:189958|mtp:S|qry_typ:P|lang:en|wc:4|cs:8905|v=4,False,Valiv,Thane,"Gala No. F-19-20, 1st Floor, Rajprabha Anand Industrial Estate Naikpada, Waliv, Valiv, Thane - 401208, Dist.Thane, Maharashtra",8047631791,
"Pink Kids Hair Brush, 3-12 Months",https://www.indiamart.com/proddetail/kids-hair-brush-2853425851355.html?pos=31&kwd=baby brush and swab&tags=||||9618.383|Price|product|||MDC|rsf:gd-|-stype:attr=1|qr_nm:gd|res:RC3|com-cf:nl|ptrs:na|ktp:N0|mc:189958|mtp:S|qry_typ:P|lang:en|wc:4|cs:8905|v=4,Texco,https://www.indiamart.com/texco/?pos=31&kwd=baby brush and swab&tags=||||9618.383|Price|product|||MDC|rsf:gd-|-stype:attr=1|qr_nm:gd|res:RC3|com-cf:nl|ptrs:na|ktp:N0|mc:189958|mtp:S|qry_typ:P|lang:en|wc:4|cs:8905|v=4,False,Bistupur,Jamshedpur,"Shop No. 2, Main Road, Bistupur, Bistupur, Jamshedpur - 831001, Dist.East Singhbhum, Jharkhand",7949092933,
Blue Plastic Hair Brush,https://www.indiamart.com/proddetail/blue-plastic-hair-brush-26196143688.html?pos=32&kwd=baby brush and swab&tags=||||8211.142|Price|product|||MDC|rsf:gd-|-stype:attr=1|qr_nm:gd|res:RC3|com-cf:nl|ptrs:na|ktp:N0|mc:189958|mtp:S|qry_typ:P|lang:en|wc:4|cs:8905|v=4,Bhojane Brothers,https://www.indiamart.com/bhojanebrothers-mumbai/?pos=32&kwd=baby brush and swab&tags=||||8211.142|Price|product|||MDC|rsf:gd-|-stype:attr=1|qr_nm:gd|res:RC3|com-cf:nl|ptrs:na|ktp:N0|mc:189958|mtp:S|qry_typ:P|lang:en|wc:4|cs:8905|v=4,False,Dadar,Mumbai,"210, 2nd Floor, Shree Hari Bldg, Shankar Palav Marg, Dadar, Dadar, Mumbai - 400014, Dist.Mumbai, Maharashtra",8043863052,
Plastic LEGIT Electric Cordless Bottle Cleaning Brush Set,https://www.indiamart.com/proddetail/legit-electric-cordless-bottle-cleaning-brush-set-2852870937233.html?pos=33&kwd=baby brush and swab&tags=||||8661.854|Price|product|||MDC|rsf:gd-|-stype:attr=1|qr_nm:gd|res:RC3|com-cf:nl|ptrs:na|ktp:N0|mc:189958|mtp:S|qry_typ:P|lang:en|wc:4|cs:8905|v=4,FAIRDEAL AGENCIES PVT. LTD.,https://www.indiamart.com/fairdeal-agencies-ltd/?pos=33&kwd=baby brush and swab&tags=||||8661.854|Price|product|||MDC|rsf:gd-|-stype:attr=1|qr_nm:gd|res:RC3|com-cf:nl|ptrs:na|ktp:N0|mc:189958|mtp:S|qry_typ:P|lang:en|wc:4|cs:8905|v=4,False,Focal Point,Ludhiana,"B-XXX57, Opp. Hero Cycles Ltd, Grand Trunk Rd, Ludhiana, Punjab, Focal Point, Ludhiana - 141010, Dist.Ludhiana, Punjab",8048960987,
Baby Hair Brush Comb,https://www.indiamart.com/proddetail/baby-hair-brush-comb-23215958248.html?pos=34&kwd=baby brush and swab&tags=||||8545.6045|Price|product|||MDC|rsf:gd-|-stype:attr=1|qr_nm:gd|res:RC3|com-cf:nl|ptrs:na|ktp:N0|mc:189958|mtp:S|qry_typ:P|lang:en|wc:4|cs:8905|v=4,Shri Siddhivinayak Traders,https://www.indiamart.com/shrisiddhivinayaktraders-firozpur/?pos=34&kwd=baby brush and swab&tags=||||8545.6045|Price|product|||MDC|rsf:gd-|-stype:attr=1|qr_nm:gd|res:RC3|com-cf:nl|ptrs:na|ktp:N0|mc:189958|mtp:S|qry_typ:P|lang:en|wc:4|cs:8905|v=4,False,Basti Nizamdin,Firozpur,"No.94, Anand Avenue, Backside Marked Office, Malwal Road, Firozpur City, Basti Nizamdin, Firozpur - 152002, Dist.Firozpur, Punjab",8046066644,
Baby Hair Brush,https://www.indiamart.com/proddetail/baby-hair-brush-2849393485548.html?pos=35&kwd=baby brush and swab&tags=||||8860.933|Price|product|||MDC|rsf:gd-|-stype:attr=1|qr_nm:gd|res:RC3|com-cf:nl|ptrs:na|ktp:N0|mc:189958|mtp:S|qry_typ:P|lang:en|wc:4|cs:8905|v=4,Indian Turf,https://www.indiamart.com/indianturf-dehradun/?pos=35&kwd=baby brush and swab&tags=||||8860.933|Price|product|||MDC|rsf:gd-|-stype:attr=1|qr_nm:gd|res:RC3|com-cf:nl|ptrs:na|ktp:N0|mc:189958|mtp:S|qry_typ:P|lang:en|wc:4|cs:8905|v=4,False,Chukkuwala,Dehradun,"56, Neshvilla Road,, Chukkuwala, Dehradun - 248001, Dist.Dehradun, Uttarakhand",8046062814,
